### ISSUE TITLE
Single port does not appear to work as expected.

### ISSUE THREAD

**Issue by kengang** [microsoft/ntttcp#28]
ntttcp.exe -s -m 1,*,192.168.1.54 -P 1 -p 5001 -t 10
 
it does a 3-way handshake on port 5001, then it attempts to connects on 6001

network trace when the tool is running: 

82	7.590065	192.168.1.2	0.000000000	192.168.1.54	TCP	0		65535	65535	23080 → 5001 [SYN] Seq=0 Win=65535 Len=0 MSS=1460 WS=256 SACK_PERM
83	7.590347	192.168.1.54	0.000282000	192.168.1.2	TCP	0		64240	64240	5001 → 23080 [SYN, ACK] Seq=0 Ack=1 Win=64240 Len=0 MSS=1460 SACK_PERM
84	7.590418	192.168.1.2	0.000071000	192.168.1.54	TCP	0		65535	65535	23080 → 5001 [ACK] Seq=1 Ack=1 Win=65535 Len=0
85	7.590702	192.168.1.2	0.000000000	192.168.1.54	TCP	0		65535	65535	23081 → 6001 [SYN] Seq=0 Win=65535 Len=0 MSS=1460 WS=256 SACK_PERM
100	8.595098	192.168.1.2	1.004396000	192.168.1.54	TCP	0		65535	65535	[TCP Retransmission] 23081 → 6001 [SYN] Seq=0 Win=65535 Len=0 MSS=1460 WS=256 SACK_PERM
126	10.599370	192.168.1.2	2.004272000	192.168.1.54	TCP	0		65535	65535	[TCP Retransmission] 23081 → 6001 [SYN] Seq=0 Win=65535 Len=0 MSS=1460 WS=256 SACK_PERM
178	14.607517	192.168.1.2	4.008147000	192.168.1.54	TCP	0		65535	65535	[TCP Retransmission] 23081 → 6001 [SYN] Seq=0 Win=65535 Len=0 MSS=1460 WS=256 SACK_PERM

**Comment by guhetier** [comment]
By design.
Consider using SecNetPerf, a more updated tool, if it fits your needs (part of https://github.com/microsoft/msquic).
