### ISSUE TITLE
ntttcp for Windows does not flush/accept socket receiver buffer with a Linux ntttcp sender

### ISSUE THREAD

**Issue by Jammrock** [microsoft/ntttcp#5]
Sender   : Ubuntu 22.04 using ntttcp for Linux version 1.4.0
Receiver : Windows Server 2019 using ntttcp 5.38

Create Windows receiver with this command:

```
ntttcp -r -m 4,*,10.2.0.3 -rb 128M
```

Start the sender on Ubuntu 22.04

```bash
ntttcp -s -m 4,*,10.2.0.3 -N -t 60
```

The transfer will run for a while, then go into TCP zero windows state. These packets are from Wireshark collected on the Windows system.

```
1894865	1198.584902	10.2.0.3	10.2.0.1	TCP	54	[TCP ZeroWindow] 5003 → 50808 [ACK] Seq=1 Ack=268436481 Win=0 Len=0

1894866	1199.608741	10.2.0.1	10.2.0.3	TCP	54	[TCP Keep-Alive] 39568 → 5004 [ACK] Seq=268452024 Ack=1 Win=65536 Len=0

1894867	1199.608896	10.2.0.3	10.2.0.1	TCP	54	[TCP ZeroWindow] 5004 → 39568 [ACK] Seq=1 Ack=268452025 Win=0 Len=0

1894868	1200.376678	10.2.0.1	10.2.0.3	TCP	54	[TCP Keep-Alive] 58052 → 5001 [ACK] Seq=268464432 Ack=1 Win=65536 Len=0

1894869	1200.376732	10.2.0.3	10.2.0.1	TCP	54	[TCP ZeroWindow] 5001 → 58052 [ACK] Seq=1 Ack=268464433 Win=0 Len=0
```

The transfer stays in this state until it ends.

The TCP zero window happens because the receiver, Windows, is advertising a TCP windows size of zero (0) [Win=0]. TCP does with then the socket receiver buffer is full. It tells the sender that it cannot send new data.

The issue happens when not using -rb, "-rb -1", or any other variation. The larger th e-rb value the longer the transfer will run, but eventually it will run out of buffer and stop transmitting. Assuming the network link is fast enough to exhaust the receive buffer value.

Changes on the sender side (-b) don't seem to affect the issue.

Using Linux as the receiver and Windows as the sender works fine.

Windows to Windows works fine, too. This only happens with a Windows receiver and Linux sender.

**Comment by maolson-msft** [comment]
I've never heard this was in the charter so I'd like to confirm with Simon before looking closer

**Comment by simonxiaoss** [comment]
Thanks! Back to 2017, yes, I did enable the interop test between Windows and Linux https://github.com/microsoft/ntttcp-for-linux/wiki/How-to-interop-with-Windows-NTttcp%3F
